[
  {
    "id": "referral-bataan-agricultural-and-biosystems-engineering-division",
    "office": "Agricultural and Biosystems Engineering Division",
    "entity": "Provincial Government of Bataan",
    "entityScope": "provincial",
    "charterEdition": "2026 1st Edition",
    "serviceCount": 3,
    "examples": [
      "ABE Technical Assistance",
      "Provision and Construction of Agri-Fisheries Machineries and Postharvest Facilities and Equipment",
      "Assistance in the Construction of Agri-Infrastructure Projects"
    ],
    "howToRead": "This service is provided by the Provincial Government of Bataan, not by the Municipality of Limay. Contact the Agricultural and Biosystems Engineering Division. Any fee or processing time is the province's, and is set out in its Citizen's Charter (2026 1st Edition).",
    "provenance": {
      "source_name": "Provincial Government of Bataan",
      "retrieved_at": "2026-09-23",
      "verified": true,
      "verification_note": "Transcribed from the published Citizen's Charter index named in this record's source.",
      "source_document": "Provincial Government of Bataan Citizen's Charter, 2026 1st Edition",
      "source_page": 71
    },
    "charterPage": 71
  },
  {
    "id": "referral-bataan-antonino-tony-p-roman-memorial-hospital-external-services",
    "office": "Antonino “Tony” P. Roman Memorial Hospital External Services",
    "entity": "Provincial Government of Bataan",
    "entityScope": "provincial",
    "charterEdition": "2026 1st Edition",
    "serviceCount": 29,
    "examples": [
      "Admission Procedure",
      "Ambulance Services- Transfer of Service to Other Facility/Hospital",
      "Ambulance Services- Patient Conduction for Diagnostic Procedure",
      "Animal Bite Treatment Services- All Patients Needing Animal Bite Treatment"
    ],
    "howToRead": "This service is provided by the Provincial Government of Bataan, not by the Municipality of Limay. Contact the Antonino “Tony” P. Roman Memorial Hospital External Services. Any fee or processing time is the province's, and is set out in its Citizen's Charter (2026 1st Edition).",
    "provenance": {
      "source_name": "Provincial Government of Bataan",
      "retrieved_at": "2026-09-23",
      "verified": true,
      "verification_note": "Transcribed from the published Citizen's Charter index named in this record's source.",
      "source_document": "Provincial Government of Bataan Citizen's Charter, 2026 1st Edition",
      "source_page": 498
    },
    "charterPage": 498
  },
  {
    "id": "referral-bataan-bagac-community-and-medicare-hospital-external-services",
    "office": "Bagac Community and Medicare Hospital External Services",
    "entity": "Provincial Government of Bataan",
    "entityScope": "provincial",
    "charterEdition": "2026 1st Edition",
    "serviceCount": 17,
    "examples": [
      "Admission of Patients",
      "Animal Bite Treatment Center",
      "Billing",
      "Billing (Philhealth or non-Philhealth patients with excess bill)"
    ],
    "howToRead": "This service is provided by the Provincial Government of Bataan, not by the Municipality of Limay. Contact the Bagac Community and Medicare Hospital External Services. Any fee or processing time is the province's, and is set out in its Citizen's Charter (2026 1st Edition).",
    "provenance": {
      "source_name": "Provincial Government of Bataan",
      "retrieved_at": "2026-09-23",
      "verified": true,
      "verification_note": "Transcribed from the published Citizen's Charter index named in this record's source.",
      "source_document": "Provincial Government of Bataan Citizen's Charter, 2026 1st Edition",
      "source_page": 546
    },
    "charterPage": 546
  },
  {
    "id": "referral-bataan-bataan-human-settlement-office-external-services",
    "office": "Bataan Human Settlement Office External Services",
    "entity": "Provincial Government of Bataan",
    "entityScope": "provincial",
    "charterEdition": "2026 1st Edition",
    "serviceCount": 3,
    "examples": [
      "Provision of Assistance to Walk-in Clients on Housing Inquiries and Concerns",
      "Orientation and Model-Units Tour of 1Bataan Village Housing Showroom",
      "Facilitation for the Registration of Community/ Homeowners Association"
    ],
    "howToRead": "This service is provided by the Provincial Government of Bataan, not by the Municipality of Limay. Contact the Bataan Human Settlement Office External Services. Any fee or processing time is the province's, and is set out in its Citizen's Charter (2026 1st Edition).",
    "provenance": {
      "source_name": "Provincial Government of Bataan",
      "retrieved_at": "2026-09-23",
      "verified": true,
      "verification_note": "Transcribed from the published Citizen's Charter index named in this record's source.",
      "source_document": "Provincial Government of Bataan Citizen's Charter, 2026 1st Edition",
      "source_page": 376
    },
    "charterPage": 376
  },
  {
    "id": "referral-bataan-bataan-public-private-partnership-and-investment-center-external-services",
    "office": "Bataan Public-Private Partnership and Investment Center External Services",
    "entity": "Provincial Government of Bataan",
    "entityScope": "provincial",
    "charterEdition": "2026 1st Edition",
    "serviceCount": 8,
    "examples": [
      "Benchmarking of other LGUs and other government offices",
      "Facilitation, Assistance, and Participation in PPP Project Negotiation and Implementation",
      "Meeting with Proponents/investors",
      "Non-renewal of the Sublease Agreement of Commercial and Office Space at the Bunker Building"
    ],
    "howToRead": "This service is provided by the Provincial Government of Bataan, not by the Municipality of Limay. Contact the Bataan Public-Private Partnership and Investment Center External Services. Any fee or processing time is the province's, and is set out in its Citizen's Charter (2026 1st Edition).",
    "provenance": {
      "source_name": "Provincial Government of Bataan",
      "retrieved_at": "2026-09-23",
      "verified": true,
      "verification_note": "Transcribed from the published Citizen's Charter index named in this record's source.",
      "source_document": "Provincial Government of Bataan Citizen's Charter, 2026 1st Edition",
      "source_page": 439
    },
    "charterPage": 439
  },
  {
    "id": "referral-bataan-capitol-security-intelligence-unit",
    "office": "Capitol Security Intelligence Unit",
    "entity": "Provincial Government of Bataan",
    "entityScope": "provincial",
    "charterEdition": "2026 1st Edition",
    "serviceCount": 3,
    "examples": [
      "Assistance to Internal / External Clients during Events",
      "Incident Report",
      "Investigation Report"
    ],
    "howToRead": "This service is provided by the Provincial Government of Bataan, not by the Municipality of Limay. Contact the Capitol Security Intelligence Unit. Any fee or processing time is the province's, and is set out in its Citizen's Charter (2026 1st Edition).",
    "provenance": {
      "source_name": "Provincial Government of Bataan",
      "retrieved_at": "2026-09-23",
      "verified": true,
      "verification_note": "Transcribed from the published Citizen's Charter index named in this record's source.",
      "source_document": "Provincial Government of Bataan Citizen's Charter, 2026 1st Edition",
      "source_page": 435
    },
    "charterPage": 435
  },
  {
    "id": "referral-bataan-iskolar-ng-bataan",
    "office": "Iskolar ng Bataan",
    "entity": "Provincial Government of Bataan",
    "entityScope": "provincial",
    "charterEdition": "2026 1st Edition",
    "serviceCount": 20,
    "examples": [
      "Application for Professional Eligibility Review Assistance",
      "ATM Card Enrollment for Scholarship Beneficiaries",
      "Awarding of Professional Eligibility Review Assistance",
      "Awarding of Scholarship Grants to Gurong Iskolar and Vocational Iskolar"
    ],
    "howToRead": "This service is provided by the Provincial Government of Bataan, not by the Municipality of Limay. Contact the Iskolar ng Bataan. Any fee or processing time is the province's, and is set out in its Citizen's Charter (2026 1st Edition).",
    "provenance": {
      "source_name": "Provincial Government of Bataan",
      "retrieved_at": "2026-09-23",
      "verified": true,
      "verification_note": "Transcribed from the published Citizen's Charter index named in this record's source.",
      "source_document": "Provincial Government of Bataan Citizen's Charter, 2026 1st Edition",
      "source_page": 46
    },
    "charterPage": 46
  },
  {
    "id": "referral-bataan-jose-c-payumo-jr-memorial-hospital-external-services",
    "office": "Jose C. Payumo Jr. Memorial Hospital External Services",
    "entity": "Provincial Government of Bataan",
    "entityScope": "provincial",
    "charterEdition": "2026 1st Edition",
    "serviceCount": 27,
    "examples": [
      "Admission",
      "Animal Bite Treatment Center",
      "Antiretroviral (ARV) Refill",
      "Antiretroviral Treatment Initiation (HIV/Hepa B)"
    ],
    "howToRead": "This service is provided by the Provincial Government of Bataan, not by the Municipality of Limay. Contact the Jose C. Payumo Jr. Memorial Hospital External Services. Any fee or processing time is the province's, and is set out in its Citizen's Charter (2026 1st Edition).",
    "provenance": {
      "source_name": "Provincial Government of Bataan",
      "retrieved_at": "2026-09-23",
      "verified": true,
      "verification_note": "Transcribed from the published Citizen's Charter index named in this record's source.",
      "source_document": "Provincial Government of Bataan Citizen's Charter, 2026 1st Edition",
      "source_page": 457
    },
    "charterPage": 457
  },
  {
    "id": "referral-bataan-metro-bataan-development-authority-external-services",